{
  "$schema": "https://json-schema.org/draft/2020-12/schema",
  "title": "UsaBanner configuration",
  "description": "Every setting of a host's banners, in one file. A key left out takes its value from defaults.json.",
  "type": "object",
  "additionalProperties": false,
  "required": [
    "version"
  ],
  "properties": {
    "version": {
      "description": "The shape of this file. It goes up only when a file written for the old shape would be read wrongly.",
      "const": 1
    },
    "company": {
      "description": "The company name, for 'Welcome to <company>'. It shows before login, so printable ASCII only, and short enough for the 64-column box.",
      "$ref": "#/$defs/ascii",
      "maxLength": 48
    },
    "environment": {
      "description": "The tier the host belongs to. UNSET takes the tier from the host's AD Description, as \"PROD : Web front end\" gives PROD; with none there, it draws a grey badge.",
      "enum": [
        "UNSET",
        "DEV-TEST",
        "LAB",
        "PROD",
        "PUB"
      ]
    },
    "role": {
      "description": "What the host is for, in a few words, shown after login. Empty takes the role from the host's AD Description, as \"PROD : Web front end\" gives Web front end.",
      "$ref": "#/$defs/ascii",
      "maxLength": 64
    },
    "art": {
      "type": "object",
      "additionalProperties": false,
      "properties": {
        "name": {
          "description": "A built-in piece of art, by name. 'os' is our pictogram in the host's OS colour.",
          "type": "string",
          "pattern": "^[a-z0-9][a-z0-9-]*$"
        }
      }
    },
    "color": {
      "type": "object",
      "additionalProperties": false,
      "properties": {
        "mode": {
          "description": "This host's colour mode. auto reads the terminal's signals; anything else is what the admin found works here. USABANNER_COLOR in a user's environment overrides it.",
          "enum": [
            "auto",
            "truecolor",
            "256",
            "16",
            "none"
          ]
        },
        "preset": {
          "description": "The colour scheme.",
          "enum": [
            "UsagiTools",
            "Classic16",
            "HighContrast",
            "Mono",
            "Custom"
          ]
        }
      }
    },
    "glyphs": {
      "description": "Whether the banner after login draws its lines, bars and marks in Unicode, or in ASCII for clients that are not UTF-8. auto reads the client's locale; anything else is what the admin found the clients of this host show. USABANNER_GLYPHS in a user's environment overrides it.",
      "enum": [
        "auto",
        "unicode",
        "ascii"
      ]
    },
    "border": {
      "type": "object",
      "additionalProperties": false,
      "properties": {
        "set": {
          "description": "The box's lines and corners. Rounded, Single, Double, Heavy and Block are Unicode: after login only, with Classic before login and wherever the client is not UTF-8.",
          "enum": [
            "Classic",
            "Hash",
            "Star",
            "Equals",
            "Round",
            "Bevel",
            "PipeUnderscore",
            "Wavy",
            "OneChar",
            "Rounded",
            "Single",
            "Double",
            "Heavy",
            "Block"
          ]
        },
        "char": {
          "description": "The character OneChar draws with.",
          "type": "string",
          "pattern": "^[!-~]$"
        },
        "cap": {
          "description": "A label centred in the top line, between the title and the hint: an ASCII face such as (^_^).",
          "$ref": "#/$defs/ascii",
          "maxLength": 16
        }
      }
    },
    "legal": {
      "type": "object",
      "additionalProperties": false,
      "properties": {
        "template": {
          "description": "L1 (friendly) to L5 (maximum), or custom for the lines in text.",
          "enum": [
            "L1",
            "L2",
            "L3",
            "L4",
            "L5",
            "custom"
          ]
        },
        "text": {
          "description": "The custom legal text, one string per line. It shows before login: printable ASCII only.",
          "type": "array",
          "items": {
            "$ref": "#/$defs/ascii"
          }
        }
      }
    },
    "voice": {
      "description": "A meme voice for a lab VM: the banner's own words rewritten, never its facts. plain is no voice.",
      "enum": [
        "plain",
        "uwu",
        "random",
        "leet"
      ]
    },
    "preInit": {
      "description": "What the console shows before login, besides the company name and the legal text.",
      "$ref": "#/$defs/shown"
    },
    "preLogon": {
      "description": "What the SSH banner shows before authentication, besides the company name and the legal text. Anyone who starts to log in can read it.",
      "$ref": "#/$defs/shown"
    },
    "vlans": {
      "description": "The VLAN table: the post-login banner names the VLAN the host's address is in.",
      "type": "array",
      "items": {
        "type": "object",
        "additionalProperties": false,
        "required": [
          "name",
          "tag",
          "cidr"
        ],
        "properties": {
          "name": {
            "$ref": "#/$defs/ascii",
            "minLength": 1,
            "maxLength": 32
          },
          "tag": {
            "type": "integer",
            "minimum": 1,
            "maximum": 4094
          },
          "cidr": {
            "description": "An IPv4 network, as 10.20.30.0/24.",
            "type": "string",
            "pattern": "^([0-9]{1,3}\\.){3}[0-9]{1,3}/[0-9]{1,2}$"
          },
          "color": {
            "description": "The colour of the VLAN's badge after login. Without one, the badge is grey.",
            "$ref": "#/$defs/colorName"
          },
          "short": {
            "description": "The VLAN's name in the badge, as Servers in 'HQ - 40-Servers'. Without one, the badge shows the name.",
            "$ref": "#/$defs/ascii",
            "minLength": 1,
            "maxLength": 12
          }
        }
      }
    },
    "naming": {
      "description": "The naming standard host names are decoded with: <site:2><type><subtype><os>-<name><number>, so h-vsl-web1 is HQ / Virtual / Server / Linux. A name is decoded only when its type, subtype and OS are all listed; a site that is not listed shows as ?. The sites shipped are examples: list your own. An empty types list turns decoding off.",
      "type": "object",
      "additionalProperties": false,
      "properties": {
        "sites": {
          "description": "Two characters: a site letter, then a sub-site letter or - for none.",
          "type": "array",
          "items": {
            "$ref": "#/$defs/siteRow"
          }
        },
        "types": {
          "description": "The third character: what kind of machine it is.",
          "type": "array",
          "items": {
            "$ref": "#/$defs/codeRow"
          }
        },
        "subtypes": {
          "description": "The fourth character: what the machine does.",
          "type": "array",
          "items": {
            "$ref": "#/$defs/codeRow"
          }
        },
        "os": {
          "description": "The fifth character: the operating system.",
          "type": "array",
          "items": {
            "$ref": "#/$defs/codeRow"
          }
        }
      }
    },
    "services": {
      "description": "The services the post-login banner watches: 'default' for the OS's own list, or the names.",
      "type": [
        "string",
        "array"
      ],
      "pattern": "^default$",
      "items": {
        "type": "string",
        "pattern": "^[A-Za-z0-9_.@-]+$"
      }
    },
    "update": {
      "description": "The update channel (D14). off looks for nothing. notify looks for a newer release once a day, and the banner after login says when there is one. install installs it, each file checked against the release's SHA256SUMS. The job runs as root (SYSTEM): whoever can change the releases at the source can change what runs on this host.",
      "type": "object",
      "additionalProperties": false,
      "properties": {
        "mode": {
          "enum": [
            "off",
            "notify",
            "install"
          ]
        },
        "source": {
          "description": "The https address the releases' files are downloaded from: SHA256SUMS and UsaBanner-<version>.zip are found under it, as under a GitHub repository's .../releases/latest/download, or a GitLab project's .../-/releases/permalink/latest/downloads. Empty while the mode is off.",
          "type": "string",
          "pattern": "^(https://[!-~]+)?$",
          "maxLength": 512
        }
      }
    }
  },
  "$defs": {
    "ascii": {
      "description": "Printable ASCII, space to tilde.",
      "type": "string",
      "pattern": "^[ -~]*$"
    },
    "shown": {
      "type": "object",
      "additionalProperties": false,
      "properties": {
        "hostName": {
          "type": "boolean"
        },
        "ip": {
          "type": "boolean"
        }
      }
    },
    "colorName": {
      "description": "One of the named colours, each drawn in 24-bit colour and as its nearest of the 16 basic ones.",
      "enum": [
        "Pink",
        "White",
        "Beige",
        "Grey",
        "Black",
        "Red",
        "Green",
        "Blue",
        "Yellow",
        "Orange",
        "Purple",
        "L.Green",
        "Teal",
        "Gold",
        "Brown"
      ]
    },
    "siteRow": {
      "type": "object",
      "additionalProperties": false,
      "required": [
        "code",
        "name"
      ],
      "properties": {
        "code": {
          "type": "string",
          "pattern": "^[a-z0-9][a-z0-9-]$"
        },
        "name": {
          "$ref": "#/$defs/ascii",
          "minLength": 1,
          "maxLength": 24
        },
        "color": {
          "description": "The colour of this code's letters in the host name after login.",
          "$ref": "#/$defs/colorName"
        }
      }
    },
    "codeRow": {
      "type": "object",
      "additionalProperties": false,
      "required": [
        "code",
        "name"
      ],
      "properties": {
        "code": {
          "type": "string",
          "pattern": "^[a-z0-9]$"
        },
        "name": {
          "$ref": "#/$defs/ascii",
          "minLength": 1,
          "maxLength": 24
        },
        "color": {
          "description": "The colour of this code's letter in the host name after login.",
          "$ref": "#/$defs/colorName"
        }
      }
    }
  }
}
